{
  "id": "8d2f3e4a-5b6c-4d7e-9f8a-0b1c2d3e4f5a",
  "version": 1,
  "name": "apx-equipment-roles",
  "creator": { "id": "a1000000-0000-4000-8000-000000000001", "className": "Organisation" },
  "locator": "https://apx-standard.org/registries/apx-equipment-roles.json",
  "userDefinedCodeListEntries": [
    { "definedValue": "gate", "entryDescription": "Vehicle barrier: a barrier arm.", "entryIndex": 0 },
    { "definedValue": "overheadDoor", "entryDescription": "Vehicle barrier: a rolling or overhead door.", "entryIndex": 1 },
    { "definedValue": "bollard", "entryDescription": "Vehicle barrier: a retractable bollard.", "entryIndex": 2 },
    { "definedValue": "trafficSpikes", "entryDescription": "Vehicle barrier: one-way tyre spikes.", "entryIndex": 3 },
    { "definedValue": "accessDoor", "entryDescription": "Pedestrian barrier: a door a parker authenticates at to enter the facility, for example after hours to reach their car. Place-level equipment with no lane.", "entryIndex": 4 },
    { "definedValue": "turnstile", "entryDescription": "Pedestrian barrier: a turnstile at a pedestrian entrance.", "entryIndex": 5 },
    { "definedValue": "ticketDispenser", "entryDescription": "Ticketing: the entry station that issues a ticket or token.", "entryIndex": 6 },
    { "definedValue": "exitVerifier", "entryDescription": "Ticketing: the exit station that reads the ticket or credential and opens the gate.", "entryIndex": 7 },
    { "definedValue": "exitPayStation", "entryDescription": "Payment: a pay-in-lane station at the exit (APDS type paymentMachine).", "entryIndex": 8 },
    { "definedValue": "payOnFoot", "entryDescription": "Payment: a central pay station away from the lanes (APDS type paymentMachine).", "entryIndex": 9 },
    { "definedValue": "cashierBooth", "entryDescription": "Payment: a staffed booth.", "entryIndex": 10 },
    { "definedValue": "validationTerminal", "entryDescription": "Payment: a merchant validator.", "entryIndex": 11 },
    { "definedValue": "paymentTerminal", "entryDescription": "Payment: a standalone card or tap terminal.", "entryIndex": 12 },
    { "definedValue": "cardReader", "entryDescription": "Credential reader: an access or proximity card reader.", "entryIndex": 13 },
    { "definedValue": "tagReader", "entryDescription": "Credential reader: an RFID, transponder or AVI tag reader.", "entryIndex": 14 },
    { "definedValue": "barcodeReader", "entryDescription": "Credential reader: a QR or barcode reader for reservations and mobile passes.", "entryIndex": 15 },
    { "definedValue": "loopDetector", "entryDescription": "Vehicle detection: an in-ground loop.", "entryIndex": 16 },
    { "definedValue": "presenceSensor", "entryDescription": "Vehicle detection: a non-loop vehicle sensor (radar, ultrasonic, magnetic).", "entryIndex": 17 },
    { "definedValue": "camera", "entryDescription": "A camera anywhere on the site; what it looks at, how it is mounted and how it is viewed are in the apds-ext:apx:camera@1.0 decoration (Part 26 §26.3).", "entryIndex": 18 },
    { "definedValue": "intercom", "entryDescription": "Communications: a help button with two-way audio and/or video.", "entryIndex": 19 },
    { "definedValue": "analogDialer", "entryDescription": "Communications: a help button on a phone line.", "entryIndex": 20 },
    { "definedValue": "emergencyPhone", "entryDescription": "Communications: a dedicated emergency call box.", "entryIndex": 21 },
    { "definedValue": "laneDisplay", "entryDescription": "Signs and displays: a message screen at the lane.", "entryIndex": 22 },
    { "definedValue": "laneSignal", "entryDescription": "Signs and displays: an open/closed light or traffic light.", "entryIndex": 23 },
    { "definedValue": "countSign", "entryDescription": "Signs and displays: a spaces-available sign.", "entryIndex": 24 },
    { "definedValue": "laneController", "entryDescription": "On-site infrastructure: a lane computer or controller.", "entryIndex": 25 },
    { "definedValue": "facilityServer", "entryDescription": "On-site infrastructure: the on-site PARCS server.", "entryIndex": 26 },
    { "definedValue": "videoRecorder", "entryDescription": "On-site infrastructure: a DVR or NVR; a camera's recorder points here.", "entryIndex": 27 },
    { "definedValue": "videoGateway", "entryDescription": "On-site infrastructure: the gateway that issues short-lived camera links (Part 26 §26.4).", "entryIndex": 28 },
    { "definedValue": "other", "entryDescription": "Hardware none of the other codes fit. A code, not free text; propose a new code rather than describing the item in prose.", "entryIndex": 29 }
  ]
}
